{
  "$schema": "https://json-schema.org/draft/2020-12/schema",
  "$id": "https://socioprophet.org/schemas/composition/sociosphere-authority-dependency-graph-tier2-binding.v1.json",
  "title": "SocioSphere Authority Dependency Graph — Tier 2 Invariant Binding",
  "description": "Doctrine-only schema binding SocioSphere authority-dependency graph compositions to ProCybernetica Tier 2 invariant declared modes. Opaque hashes only; no runtime authority resolution, cancellation propagation, estate-topology verification, chain traversal, or cross-plane attestation.",
  "type": "object",
  "additionalProperties": false,
  "required": [
    "composition_id",
    "composition_kind",
    "binding_doctrine_version",
    "authority_dependency_refs",
    "control_effect_refs",
    "cancellation_binding_refs",
    "plane_owner_refs",
    "bound_modes",
    "non_claims"
  ],
  "properties": {
    "composition_id": {"const": "sociosphere.authority_dependency_graph"},
    "composition_kind": {"const": "estate_authority_dependency_graph_composition"},
    "binding_doctrine_version": {
      "type": "string",
      "pattern": "^v[0-9]+\\.[0-9]+$",
      "description": "Doctrine version under which this binding is declared. Pins the binding to a specific Tier 2 invariant binding revision."
    },
    "authority_dependency_refs": {"type": "array", "minItems": 1, "items": {"$ref": "#/$defs/graph_ref"}},
    "control_effect_refs": {"type": "array", "minItems": 1, "items": {"$ref": "#/$defs/graph_ref"}},
    "cancellation_binding_refs": {"type": "array", "minItems": 1, "items": {"$ref": "#/$defs/graph_ref"}},
    "plane_owner_refs": {"type": "array", "minItems": 2, "items": {"$ref": "#/$defs/plane_owner_ref"}},
    "bound_modes": {
      "type": "object",
      "additionalProperties": false,
      "required": [
        "receipt_integration",
        "authority_scope_analysis",
        "non_claim_analysis",
        "monitor_independence_analysis",
        "evidence_freshness_analysis"
      ],
      "properties": {
        "receipt_integration": {"const": "hash_bound_reference"},
        "authority_scope_analysis": {"const": "declared_scope_lattice_v1"},
        "non_claim_analysis": {"const": "explicit_propagate_or_resolve_v1"},
        "monitor_independence_analysis": {"const": "declared_monitor_independence_v1"},
        "evidence_freshness_analysis": {"const": "declared_evidence_freshness_v1"}
      }
    },
    "non_claims": {
      "type": "array",
      "minItems": 10,
      "maxItems": 10,
      "uniqueItems": true,
      "items": {
        "enum": [
          "no_runtime_receipt_lookup",
          "no_runtime_non_claim_verification",
          "no_runtime_monitor_attestation",
          "no_timestamp_authenticity",
          "opaque_hashes_not_resolved",
          "no_runtime_authority_resolution",
          "no_runtime_cancellation_propagation",
          "no_estate_topology_verification",
          "no_authority_chain_traversal",
          "no_cross_plane_runtime_attestation"
        ]
      }
    }
  },
  "$defs": {
    "graph_ref": {
      "type": "object",
      "additionalProperties": false,
      "required": ["ref_kind", "ref_id", "opaque_hash"],
      "properties": {
        "ref_kind": {
          "type": "string",
          "enum": ["authority_dependency", "control_effect", "cancellation_binding"]
        },
        "ref_id": {"type": "string"},
        "opaque_hash": {
          "type": "string",
          "pattern": "^sha256:[0-9a-f]{64}$",
          "description": "Opaque content-addressed reference. This binding schema does not resolve the hash at validation time."
        }
      }
    },
    "plane_owner_ref": {
      "type": "object",
      "additionalProperties": false,
      "required": ["plane_id", "owner_repo", "opaque_hash"],
      "properties": {
        "plane_id": {
          "type": "string",
          "enum": [
            "superconscious",
            "procybernetica",
            "sociosphere",
            "policy-fabric",
            "agentplane",
            "sourceos-syncd",
            "model-governance-ledger",
            "prophet-platform",
            "other"
          ]
        },
        "owner_repo": {"type": "string"},
        "opaque_hash": {
          "type": "string",
          "pattern": "^sha256:[0-9a-f]{64}$",
          "description": "Opaque content-addressed reference for declared plane ownership. This binding schema does not verify ownership at validation time."
        }
      }
    }
  }
}
